<?xml version="1.0" encoding="UTF-8"?>
<systeme_bike xmlns:xsi="http://www.w3.org/2001/XMLSchema-instance"
              xsi:noNamespaceSchemaLocation="bike.xsd">
    <bikes>
        <bike id="B1" ref="2025A">
            <marque>Trek</marque>
            <modele>Domane SL6</modele>
            <type>Route</type>
            <prix>1800</prix>
            <disponibilite>oui</disponibilite>
        </bike>

        <bike id="B2" ref="2025B">
            <marque>Specialized</marque>
            <modele>Allez Sprint</modele>
            <type>Course</type>
            <prix>2100</prix>
            <disponibilite>non</disponibilite>
        </bike>
    </bikes>

    <clients>
        <client id="C1" ref="CL100">
            <nom>Ben Salah</nom>
            <prenom>Hana</prenom>
            <email>hana.bensalah@example.com</email>
            <telephone>25123456</telephone>
        </client>

        <client id="C2" ref="CL200">
            <nom>Gharbi</nom>
            <prenom>Ali</prenom>
            <email>ali.gharbi@example.com</email>
            <telephone>22112233</telephone>
        </client>
    </clients>

    <locations>
        <location id="L1">
            <bike_ref>B1</bike_ref>
            <client_ref>C1</client_ref>
            <date_debut>2025-10-20</date_debut>
            <date_fin>2025-10-25</date_fin>
            <prix_total>150</prix_total>
        </location>
    </locations>
</systeme_bike>
